{
  "$schema": "http://json-schema.org/draft-07/schema#",
  "title": "AppShark LLM Vulnerability Verdict",
  "description": "Structured verdict from LLM review of AppShark scan findings",
  "type": "object",
  "required": ["rule_name", "apk_path", "finding_id", "source", "sink", "taint_path", "verdict", "confidence", "reasoning_summary"],
  "properties": {
    "rule_name": {
      "type": "string",
      "description": "Name of the AppShark rule that triggered this finding"
    },
    "apk_path": {
      "type": "string",
      "description": "Path to the scanned APK file"
    },
    "finding_id": {
      "type": "string",
      "description": "Unique hash of the vulnerability finding from results.json"
    },
    "entry_method": {
      "type": "string",
      "description": "Jimple signature of the analysis entry method"
    },
    "source": {
      "type": "string",
      "description": "Source variable and location from the taint path"
    },
    "sink": {
      "type": "string",
      "description": "Sink variable and location from the taint path"
    },
    "taint_path": {
      "type": "array",
      "items": { "type": "string" },
      "description": "Ordered list of taint propagation steps from source to sink"
    },
    "manifest_context": {
      "type": "object",
      "properties": {
        "component_exported": { "type": "boolean" },
        "component_permission": { "type": "string" },
        "protection_level": { "type": "string" },
        "intent_filters": { "type": "array", "items": { "type": "string" } }
      },
      "description": "Manifest-level context for the affected component"
    },
    "sanitizer_hits": {
      "type": "array",
      "items": {
        "type": "object",
        "properties": {
          "sanitizer_name": { "type": "string" },
          "matched": { "type": "boolean" },
          "location": { "type": "string" }
        }
      },
      "description": "Which sanitizers were checked and whether they matched"
    },
    "verdict": {
      "type": "string",
      "enum": ["real_vulnerability", "likely_false_positive", "needs_manual_review"],
      "description": "LLM's verdict on whether this is a real vulnerability"
    },
    "confidence": {
      "type": "number",
      "minimum": 0,
      "maximum": 1,
      "description": "Confidence score for the verdict (0.0 to 1.0)"
    },
    "reasoning_summary": {
      "type": "string",
      "description": "Concise explanation of why the LLM reached this verdict"
    },
    "evidence_for": {
      "type": "array",
      "items": { "type": "string" },
      "description": "Evidence supporting that this is a real vulnerability"
    },
    "evidence_against": {
      "type": "array",
      "items": { "type": "string" },
      "description": "Evidence suggesting this is a false positive"
    },
    "required_follow_up": {
      "type": "array",
      "items": { "type": "string" },
      "description": "Actions needed if verdict is needs_manual_review"
    }
  }
}
