{
  "rule_name": "IntentRedirectionEnhanced",
  "apk_path": "/path/to/vulnerable-app.apk",
  "finding_id": "abc123hash",
  "entry_method": "<com.example.app.ProxyActivity: void onCreate(android.os.Bundle)>",
  "source": "<com.example.app.ProxyActivity: void onCreate(android.os.Bundle)>->$r3 (getParcelableExtra return)",
  "sink": "<com.example.app.ProxyActivity: void onCreate(android.os.Bundle)>->$r5 (startActivity param)",
  "taint_path": [
    "$r3 = virtualinvoke $r1.<android.content.Intent: android.os.Parcelable getParcelableExtra(java.lang.String)>(\"next\")",
    "$r4 = (android.content.Intent) $r3",
    "virtualinvoke $r0.<android.app.Activity: void startActivity(android.content.Intent)>($r4)"
  ],
  "manifest_context": {
    "component_exported": true,
    "component_permission": "",
    "protection_level": "",
    "intent_filters": ["android.intent.action.VIEW"]
  },
  "sanitizer_hits": [
    { "sanitizer_name": "setComponent", "matched": false, "location": "" },
    { "sanitizer_name": "setPackage", "matched": false, "location": "" }
  ],
  "verdict": "real_vulnerability",
  "confidence": 0.92,
  "reasoning_summary": "Exported ProxyActivity extracts a Parcelable Intent from extras and directly passes it to startActivity() with no component validation, package restriction, or flag sanitization. Any app can craft a malicious Intent to launch private internal components or steal URI permissions.",
  "evidence_for": [
    "Component is exported with no permission requirement",
    "getParcelableExtra return flows directly to startActivity without any validation",
    "No setComponent/setPackage/setClass sanitizer detected on the taint path",
    "No removeFlags call detected — attacker can set FLAG_GRANT_READ_URI_PERMISSION"
  ],
  "evidence_against": [],
  "required_follow_up": []
}
